{
  "$schema": "https://json-schema.org/draft/2020-12/schema",
  "$id": "https://groovekit.dev/schema/project.schema.json",
  "title": "Project",
  "description": "A GrooveKit project (song.json). Times are integer ticks at 960 PPQ unless a field says otherwise.",
  "type": "object",
  "required": ["schemaVersion", "tempo", "channels", "patterns", "playlist", "mixer"],
  "additionalProperties": false,
  "properties": {
    "schemaVersion": { "const": 1 },
    "name": { "type": "string", "default": "" },
    "tempo": { "description": "Beats per minute.", "type": "number", "minimum": 20, "maximum": 999 },
    "timeSignature": { "$ref": "#/$defs/TimeSignature" },
    "swing": { "description": "Delays every second 16th note by up to half a 16th (1: a dotted-16th feel). Applies to pattern notes that start on an off-beat 16th.", "type": "number", "minimum": 0, "maximum": 1, "default": 0 },
    "channels": { "type": "array", "items": { "$ref": "#/$defs/Channel" } },
    "patterns": { "type": "array", "items": { "$ref": "#/$defs/Pattern" } },
    "playlist": { "$ref": "#/$defs/Playlist" },
    "mixer": { "$ref": "#/$defs/Mixer" }
  },
  "$defs": {
    "Id": {
      "description": "Stable identifier, unique within its collection.",
      "type": "string",
      "pattern": "^[A-Za-z0-9_.-]{1,64}$"
    },
    "Ticks": { "description": "Position in ticks (960 per quarter note).", "type": "integer", "minimum": 0 },
    "TickLength": { "description": "Duration in ticks (960 per quarter note).", "type": "integer", "minimum": 1 },
    "Pan": { "description": "-1 is hard left, 0 centre, 1 hard right.", "type": "number", "minimum": -1, "maximum": 1 },
    "Key": { "description": "MIDI note number; 60 is C4.", "type": "integer", "minimum": 0, "maximum": 127 },

    "TimeSignature": {
      "type": "object",
      "additionalProperties": false,
      "properties": {
        "numerator": { "type": "integer", "minimum": 1, "maximum": 32, "default": 4 },
        "denominator": { "type": "integer", "enum": [1, 2, 4, 8, 16], "default": 4 }
      }
    },

    "Channel": {
      "description": "A channel-rack entry: one instrument whose output feeds a mixer insert.",
      "type": "object",
      "required": ["id", "instrument"],
      "additionalProperties": false,
      "properties": {
        "id": { "$ref": "#/$defs/Id" },
        "name": { "type": "string", "default": "" },
        "color": { "type": "string" },
        "volumeDb": { "type": "number", "minimum": -100, "maximum": 24, "default": 0 },
        "pan": { "$ref": "#/$defs/Pan", "default": 0 },
        "mute": { "type": "boolean", "default": false },
        "solo": { "description": "While any channel is soloed, only soloed channels play.", "type": "boolean", "default": false },
        "insert": { "description": "Mixer insert this channel feeds.", "$ref": "#/$defs/Id", "default": "master" },
        "instrument": { "$ref": "#/$defs/Instrument" }
      }
    },

    "Instrument": {
      "oneOf": [{ "$ref": "#/$defs/SamplerInstrument" }, { "$ref": "#/$defs/PluginInstrument" }],
      "discriminator": { "propertyName": "type" }
    },

    "SamplerInstrument": {
      "description": "Built-in polyphonic sampler. Every layer whose key and velocity range match a note plays it.",
      "type": "object",
      "required": ["type", "layers"],
      "additionalProperties": false,
      "properties": {
        "type": { "const": "sampler" },
        "polyphony": { "description": "Maximum simultaneous voices; the oldest voice is stolen.", "type": "integer", "minimum": 1, "maximum": 256, "default": 32 },
        "filter": { "description": "Filters every voice, after its layer's volume envelope.", "$ref": "#/$defs/SamplerFilter" },
        "layers": { "type": "array", "items": { "$ref": "#/$defs/SamplerLayer" } }
      }
    },

    "SamplerFilter": {
      "description": "A resonant 12 dB/octave filter per voice, its cutoff moved by its own envelope.",
      "type": "object",
      "additionalProperties": false,
      "properties": {
        "type": { "type": "string", "enum": ["off", "lowpass", "highpass", "bandpass"], "default": "off" },
        "cutoff": { "description": "Hz.", "type": "number", "minimum": 20, "maximum": 20000, "default": 20000 },
        "resonance": { "description": "0 is a gentle slope; towards 1 the cutoff rings.", "type": "number", "minimum": 0, "maximum": 1, "default": 0 },
        "envelopeAmount": { "description": "Octaves the envelope moves the cutoff at its peak; negative moves it down.", "type": "number", "minimum": -10, "maximum": 10, "default": 0 },
        "envelope": { "description": "Shape of the cutoff movement; sustain is the share of the amount held.", "$ref": "#/$defs/Envelope" }
      }
    },

    "SamplerLayer": {
      "type": "object",
      "required": ["id", "sample"],
      "additionalProperties": false,
      "properties": {
        "id": { "$ref": "#/$defs/Id" },
        "sample": { "description": "Audio file path, absolute or relative to the project folder.", "type": "string", "minLength": 1 },
        "rootKey": { "description": "Key at which the sample plays at its original pitch.", "$ref": "#/$defs/Key", "default": 60 },
        "keyRange": { "$ref": "#/$defs/KeyRange" },
        "velocityRange": { "$ref": "#/$defs/VelocityRange" },
        "pitchTracking": { "description": "If false, every key plays the sample at root pitch (drums).", "type": "boolean", "default": true },
        "transpose": { "description": "Semitones.", "type": "integer", "minimum": -48, "maximum": 48, "default": 0 },
        "fineTune": { "description": "Cents.", "type": "number", "minimum": -100, "maximum": 100, "default": 0 },
        "gainDb": { "type": "number", "maximum": 24, "default": 0 },
        "pan": { "$ref": "#/$defs/Pan", "default": 0 },
        "mode": {
          "description": "oneShot plays to the end of the sample and ignores note-off; gate releases on note-off.",
          "type": "string",
          "enum": ["oneShot", "gate"],
          "default": "oneShot"
        },
        "envelope": { "$ref": "#/$defs/Envelope" },
        "start": { "description": "Seconds into the file where the part that plays begins.", "type": "number", "minimum": 0, "default": 0 },
        "end": { "description": "Seconds into the file where the part that plays ends; unset is the file's end.", "type": "number", "minimum": 0 },
        "reverse": { "description": "Plays the part between start and end backwards.", "type": "boolean", "default": false }
      }
    },

    "KeyRange": {
      "type": "object",
      "additionalProperties": false,
      "properties": {
        "low": { "$ref": "#/$defs/Key", "default": 0 },
        "high": { "$ref": "#/$defs/Key", "default": 127 }
      }
    },

    "VelocityRange": {
      "type": "object",
      "additionalProperties": false,
      "properties": {
        "low": { "type": "integer", "minimum": 1, "maximum": 127, "default": 1 },
        "high": { "type": "integer", "minimum": 1, "maximum": 127, "default": 127 }
      }
    },

    "Envelope": {
      "description": "Attack, decay, sustain, release. Times in seconds; sustain is a level from 0 to 1.",
      "type": "object",
      "additionalProperties": false,
      "properties": {
        "attack": { "type": "number", "minimum": 0, "maximum": 30, "default": 0 },
        "decay": { "type": "number", "minimum": 0, "maximum": 30, "default": 0 },
        "sustain": { "type": "number", "minimum": 0, "maximum": 1, "default": 1 },
        "release": { "type": "number", "minimum": 0, "maximum": 30, "default": 0.01 }
      }
    },

    "PluginInstrument": {
      "type": "object",
      "required": ["type", "plugin"],
      "additionalProperties": false,
      "properties": {
        "type": { "const": "plugin" },
        "plugin": { "$ref": "#/$defs/PluginRef" }
      }
    },

    "PluginRef": {
      "description": "A hosted VST3 or AU plugin.",
      "type": "object",
      "required": ["format", "uid", "name"],
      "additionalProperties": false,
      "properties": {
        "format": { "type": "string", "enum": ["VST3", "AU"] },
        "uid": { "description": "JUCE plugin identifier string.", "type": "string", "minLength": 1 },
        "name": { "type": "string" },
        "manufacturer": { "type": "string" },
        "state": { "description": "Path of the saved state blob, relative to the project folder.", "type": "string" },
        "params": {
          "description": "Parameter id or name to normalized value (0..1), applied after the state.",
          "type": "object",
          "additionalProperties": { "type": "number", "minimum": 0, "maximum": 1 },
          "default": {}
        }
      }
    },

    "Pattern": {
      "description": "Notes for any number of channels. A pattern clip plays all of them.",
      "type": "object",
      "required": ["id", "notes"],
      "additionalProperties": false,
      "properties": {
        "id": { "$ref": "#/$defs/Id" },
        "name": { "type": "string", "default": "" },
        "color": { "type": "string" },
        "length": { "description": "Loop length. If absent, the end of the last note rounded up to a whole bar.", "$ref": "#/$defs/TickLength" },
        "notes": { "type": "array", "items": { "$ref": "#/$defs/Note" } }
      }
    },

    "Note": {
      "type": "object",
      "required": ["channel", "start", "length"],
      "additionalProperties": false,
      "properties": {
        "channel": { "$ref": "#/$defs/Id" },
        "start": { "$ref": "#/$defs/Ticks" },
        "length": { "$ref": "#/$defs/TickLength" },
        "key": { "$ref": "#/$defs/Key", "default": 60 },
        "velocity": { "type": "integer", "minimum": 1, "maximum": 127, "default": 100 }
      }
    },

    "Playlist": {
      "type": "object",
      "required": ["tracks", "clips"],
      "additionalProperties": false,
      "properties": {
        "tracks": { "type": "array", "items": { "$ref": "#/$defs/PlaylistTrack" } },
        "clips": { "type": "array", "items": { "$ref": "#/$defs/Clip" } }
      }
    },

    "PlaylistTrack": {
      "description": "A free lane; any clip can go on any track.",
      "type": "object",
      "required": ["id"],
      "additionalProperties": false,
      "properties": {
        "id": { "$ref": "#/$defs/Id" },
        "name": { "type": "string", "default": "" },
        "color": { "type": "string" },
        "mute": { "type": "boolean", "default": false },
        "solo": { "description": "While any track is soloed, only soloed tracks play.", "type": "boolean", "default": false },
        "insert": { "description": "Mixer insert the audio clips on this track play into (overriding each clip's own). Pattern clips play through their channels' inserts.", "$ref": "#/$defs/Id" },
        "volumeDb": { "description": "Level of the audio clips on this track.", "type": "number", "minimum": -100, "maximum": 24, "default": 0 },
        "pan": { "description": "Pan of the audio clips on this track.", "$ref": "#/$defs/Pan", "default": 0 }
      }
    },

    "Clip": {
      "oneOf": [{ "$ref": "#/$defs/PatternClip" }, { "$ref": "#/$defs/AudioClip" }, { "$ref": "#/$defs/AutomationClip" }],
      "discriminator": { "propertyName": "type" }
    },

    "PatternClip": {
      "description": "Plays a pattern, repeating it every pattern length until the clip ends.",
      "type": "object",
      "required": ["type", "id", "track", "start", "length", "pattern"],
      "additionalProperties": false,
      "properties": {
        "type": { "const": "pattern" },
        "id": { "$ref": "#/$defs/Id" },
        "track": { "$ref": "#/$defs/Id" },
        "start": { "$ref": "#/$defs/Ticks" },
        "length": { "$ref": "#/$defs/TickLength" },
        "mute": { "type": "boolean", "default": false },
        "pattern": { "$ref": "#/$defs/Id" },
        "offset": { "description": "Ticks into the pattern where the clip starts playing.", "$ref": "#/$defs/Ticks", "default": 0 }
      }
    },

    "AudioClip": {
      "type": "object",
      "required": ["type", "id", "track", "start", "length", "sample"],
      "additionalProperties": false,
      "properties": {
        "type": { "const": "audio" },
        "id": { "$ref": "#/$defs/Id" },
        "track": { "$ref": "#/$defs/Id" },
        "start": { "$ref": "#/$defs/Ticks" },
        "length": { "$ref": "#/$defs/TickLength" },
        "mute": { "type": "boolean", "default": false },
        "sample": { "description": "Audio file path, absolute or relative to the project folder.", "type": "string", "minLength": 1 },
        "insert": { "description": "Mixer insert this clip plays into.", "$ref": "#/$defs/Id", "default": "master" },
        "offset": { "description": "Seconds into the file where playback starts.", "type": "number", "minimum": 0, "default": 0 },
        "gainDb": { "type": "number", "maximum": 24, "default": 0 },
        "pan": { "$ref": "#/$defs/Pan", "default": 0 },
        "fadeIn": { "description": "Seconds.", "type": "number", "minimum": 0, "default": 0 },
        "fadeOut": { "description": "Seconds.", "type": "number", "minimum": 0, "default": 0 },
        "reverse": { "description": "Plays the file backwards; offset then counts from the file's end.", "type": "boolean", "default": false },
        "sourceTempo": { "description": "Tempo the file was recorded at. When set, the clip is time-stretched (pitch kept) to the project tempo; offset stays in the file's own seconds.", "type": "number", "minimum": 20, "maximum": 999 }
      }
    },

    "AutomationClip": {
      "description": "Drives one parameter. A target follows the points of all its unmuted clips; before the first point it holds the first value, after a clip it holds that clip's last value until the next point. Points past the clip's length are ignored.",
      "type": "object",
      "required": ["type", "id", "track", "start", "length", "target", "points"],
      "additionalProperties": false,
      "properties": {
        "type": { "const": "automation" },
        "id": { "$ref": "#/$defs/Id" },
        "track": { "$ref": "#/$defs/Id" },
        "start": { "$ref": "#/$defs/Ticks" },
        "length": { "$ref": "#/$defs/TickLength" },
        "mute": { "type": "boolean", "default": false },
        "target": { "$ref": "#/$defs/AutomationTarget" },
        "points": { "type": "array", "minItems": 1, "items": { "$ref": "#/$defs/AutomationPoint" } }
      }
    },

    "AutomationTarget": {
      "description": "What an automation clip drives. channel/insert: param is volume or pan. effect: param is the effect's parameter id (for plugins: id or name, values normalized 0..1). send: param is level.",
      "type": "object",
      "required": ["scope", "param"],
      "additionalProperties": false,
      "properties": {
        "scope": { "type": "string", "enum": ["channel", "insert", "effect", "send"] },
        "channel": { "$ref": "#/$defs/Id" },
        "insert": { "$ref": "#/$defs/Id" },
        "effect": { "$ref": "#/$defs/Id" },
        "send": { "$ref": "#/$defs/Id" },
        "param": { "type": "string", "minLength": 1 }
      }
    },

    "AutomationPoint": {
      "type": "object",
      "required": ["time", "value"],
      "additionalProperties": false,
      "properties": {
        "time": { "description": "Ticks from the clip start.", "$ref": "#/$defs/Ticks" },
        "value": { "description": "In the parameter's own units (dB for volume and send level, -1..1 for pan).", "type": "number" },
        "curve": { "description": "Shape of the segment to the next point: 0 linear, negative ease-in, positive ease-out.", "type": "number", "minimum": -1, "maximum": 1, "default": 0 }
      }
    },

    "Mixer": {
      "description": "Mixer inserts. The insert with id \"master\" is required and is the final output.",
      "type": "object",
      "required": ["inserts"],
      "additionalProperties": false,
      "properties": {
        "inserts": { "type": "array", "minItems": 1, "items": { "$ref": "#/$defs/Insert" } }
      }
    },

    "Insert": {
      "type": "object",
      "required": ["id"],
      "additionalProperties": false,
      "properties": {
        "id": { "$ref": "#/$defs/Id" },
        "name": { "type": "string", "default": "" },
        "color": { "type": "string" },
        "volumeDb": { "type": "number", "minimum": -100, "maximum": 24, "default": 0 },
        "pan": { "$ref": "#/$defs/Pan", "default": 0 },
        "mute": { "type": "boolean", "default": false },
        "solo": { "description": "While any insert is soloed, only soloed inserts are heard, with the inserts feeding them and the ones they feed.", "type": "boolean", "default": false },
        "output": { "description": "Insert this one feeds. Ignored on master.", "$ref": "#/$defs/Id", "default": "master" },
        "effects": { "type": "array", "items": { "$ref": "#/$defs/Effect" }, "default": [] },
        "sends": { "type": "array", "items": { "$ref": "#/$defs/Send" }, "default": [] }
      }
    },

    "Send": {
      "type": "object",
      "required": ["id", "target"],
      "additionalProperties": false,
      "properties": {
        "id": { "$ref": "#/$defs/Id" },
        "target": { "$ref": "#/$defs/Id" },
        "levelDb": { "type": "number", "minimum": -100, "maximum": 6, "default": 0 },
        "preFader": { "type": "boolean", "default": false }
      }
    },

    "Effect": {
      "oneOf": [{ "$ref": "#/$defs/BuiltinEffect" }, { "$ref": "#/$defs/PluginEffect" }],
      "discriminator": { "propertyName": "type" }
    },

    "BuiltinEffect": {
      "type": "object",
      "required": ["type", "id", "kind"],
      "additionalProperties": false,
      "properties": {
        "type": { "const": "builtin" },
        "id": { "$ref": "#/$defs/Id" },
        "kind": { "type": "string", "enum": ["eq", "compressor", "limiter", "reverb", "delay", "phaser", "chorus", "lowpass", "highpass"] },
        "bypass": { "type": "boolean", "default": false },
        "params": {
          "description": "Parameter id to value, in the units of the effect catalogue (groovekit-engine effects). Unlisted parameters keep their defaults.",
          "type": "object",
          "additionalProperties": { "type": "number" },
          "default": {}
        }
      }
    },

    "PluginEffect": {
      "type": "object",
      "required": ["type", "id", "plugin"],
      "additionalProperties": false,
      "properties": {
        "type": { "const": "plugin" },
        "id": { "$ref": "#/$defs/Id" },
        "plugin": { "$ref": "#/$defs/PluginRef" },
        "bypass": { "type": "boolean", "default": false }
      }
    }
  }
}
