{
  "schemaVersion": 1,
  "name": "Mixer routing",
  "tempo": 120,
  "channels": [
    {
      "id": "a", "insert": "drums",
      "instrument": { "type": "sampler", "layers": [{ "id": "l", "sample": "../../fixtures/samples/beep.wav", "pitchTracking": false }] }
    },
    {
      "id": "b", "pan": -1,
      "instrument": { "type": "sampler", "layers": [{ "id": "l", "sample": "../../fixtures/samples/beep.wav", "pitchTracking": false }] }
    }
  ],
  "patterns": [
    {
      "id": "p",
      "notes": [
        { "channel": "a", "start": 0, "length": 240, "velocity": 127 },
        { "channel": "b", "start": 960, "length": 240, "velocity": 127 }
      ]
    }
  ],
  "playlist": {
    "tracks": [{ "id": "t" }],
    "clips": [{ "type": "pattern", "id": "c", "track": "t", "start": 0, "length": 1920, "pattern": "p" }]
  },
  "mixer": {
    "inserts": [
      { "id": "master" },
      { "id": "drums", "volumeDb": -6 }
    ]
  }
}
